{
 "schema_version": "8ball-heatmap/1",
 "plan_id": 900002,
 "hub_id": "H1",
 "step_m": 1.0,
 "points": [
  [
   1.0,
   1.0,
   4.44
  ],
  [
   1.0,
   2.0,
   2.44
  ],
  [
   1.0,
   2.97,
   0.0
  ],
  [
   1.0,
   4.0,
   2.56
  ],
  [
   1.0,
   5.0,
   4.56
  ],
  [
   2.0,
   1.0,
   4.44
  ],
  [
   2.0,
   2.0,
   2.44
  ],
  [
   2.0,
   2.97,
   0.0
  ],
  [
   2.0,
   4.0,
   2.56
  ],
  [
   2.0,
   5.0,
   4.56
  ],
  [
   3.0,
   1.0,
   4.44
  ],
  [
   3.0,
   2.0,
   2.44
  ],
  [
   3.0,
   2.97,
   0.0
  ],
  [
   3.0,
   4.0,
   2.56
  ],
  [
   3.0,
   5.0,
   4.56
  ],
  [
   5.0,
   1.0,
   4.44
  ],
  [
   5.0,
   2.0,
   2.44
  ],
  [
   5.0,
   2.97,
   0.0
  ],
  [
   5.0,
   4.0,
   2.56
  ],
  [
   5.0,
   5.0,
   4.56
  ],
  [
   6.0,
   1.0,
   4.44
  ],
  [
   6.0,
   2.0,
   2.44
  ],
  [
   6.0,
   2.97,
   0.0
  ],
  [
   6.0,
   4.0,
   2.56
  ],
  [
   6.0,
   5.0,
   4.56
  ],
  [
   7.0,
   1.0,
   4.44
  ],
  [
   7.0,
   2.0,
   2.44
  ],
  [
   7.0,
   2.97,
   0.0
  ],
  [
   7.0,
   4.0,
   2.56
  ],
  [
   7.0,
   5.0,
   4.56
  ],
  [
   9.0,
   1.0,
   4.44
  ],
  [
   9.0,
   2.0,
   2.44
  ],
  [
   9.0,
   2.97,
   0.0
  ],
  [
   9.0,
   4.0,
   2.56
  ],
  [
   9.0,
   5.0,
   4.56
  ],
  [
   10.0,
   1.0,
   4.44
  ],
  [
   10.0,
   2.0,
   2.44
  ],
  [
   10.0,
   2.97,
   0.0
  ],
  [
   10.0,
   4.0,
   2.56
  ],
  [
   10.0,
   5.0,
   4.56
  ],
  [
   11.0,
   1.0,
   4.44
  ],
  [
   11.0,
   2.0,
   2.44
  ],
  [
   11.0,
   2.97,
   0.0
  ],
  [
   11.0,
   4.0,
   2.56
  ],
  [
   11.0,
   5.0,
   4.56
  ]
 ],
 "chosen": [
  1.0,
  2.97
 ],
 "legend": "extra J for this zone's chosen loop"
}
